ci_question_id,module,version,grade,stream,section,question_type,bloom_level,question_stem,option_a,option_b,option_c,option_d,option_e,correct_option,weightage,time_secs,career_cluster_map,difficulty,is_behavioral,adaptive_trigger,explanation
APG11HUM_GA_03,APTIPATH,V3,GRADE_11_12,HUMANITIES,GENERAL_AWARENESS,MCQ,UNDERSTAND,"The Right to Information Act 2005 (RTI) empowers Indian citizens to:","Access classified military information without restrictions","Request information from public authorities promoting government transparency and accountability — subject to certain exemptions for national security and privacy","Override all judicial decisions","Access private company financial records","N/A","B",3,45,"CORRECT=GOVERNANCE_AWARE+CIVIL_SERVICES","MEDIUM",FALSE,"BOOST_CIVIL_SERVICES","RTI Act: any citizen can request information from public authorities within 30 days. Exemptions under Section 8 (national security personal information). It has been called the most powerful transparency tool in Indian democracy."
APG11HUM_GA_04,APTIPATH,V3,GRADE_11_12,HUMANITIES,GENERAL_AWARENESS,MCQ,UNDERSTAND,"The United Nations Sustainable Development Goals (SDGs) consist of:","10 goals to be achieved by 2025","17 goals to be achieved by 2030 covering poverty hunger health education gender equality climate action and more","5 goals focused only on economic growth","50 goals with no specific timeline","N/A","B",3,45,"CORRECT=GLOBAL_AWARENESS+SOCIAL_IMPACT","MEDIUM",FALSE,"BOOST_SOCIAL_IMPACT","17 SDGs adopted in 2015: from No Poverty (SDG 1) to Partnerships (SDG 17). India's SDG index shows uneven progress — strong on some goals (renewable energy) and weak on others (hunger nutrition gender)."
APG11HUM_CE_01,APTIPATH,V3,GRADE_11_12,HUMANITIES,CREATIVE_EXPRESSION,MCQ,ANALYZE,"A persuasive essay arguing for universal basic income in India would be MOST strengthened by:","Personal anecdotes without any supporting data","Combining economic data (pilot program results from Madhya Pradesh and Sikkim) with ethical arguments (dignity poverty reduction) and addressing counterarguments (inflation moral hazard)","Using only emotional appeals about poverty","Copying arguments from a single source without attribution","N/A","B",5,90,"CORRECT=ESSAY_WRITING+CIVIL_SERVICES","HARD",FALSE,"BOOST_MEDIA+CIVIL_SERVICES","Persuasive writing requires: evidence (data from UBI pilots) + ethical reasoning (dignity rights) + counterargument engagement (inflation concerns). This three-pillar approach is the standard for UPSC essays and op-ed writing."
APG11HUM_CE_02,APTIPATH,V3,GRADE_11_12,HUMANITIES,CREATIVE_EXPRESSION,MCQ,EVALUATE,"A documentary filmmaker wants to tell the story of manual scavengers in India. The MOST ethical approach is:","Film workers without their knowledge or consent for 'authenticity'","Obtain informed consent collaborate with the community in telling their story ensure their dignity is preserved and avoid reinforcing stereotypes while highlighting systemic failures","Focus only on shocking imagery to generate maximum views","Tell the story only from the government's perspective","N/A","B",5,90,"CORRECT=MEDIA_ETHICS+SOCIAL_IMPACT","HARD",FALSE,"BOOST_MEDIA","Ethical documentary filmmaking: informed consent dignity preservation community collaboration and structural analysis (why does manual scavenging persist despite being illegal?). Exploitation of marginalized subjects is a serious ethical violation."
APG11HUM_CE_03,APTIPATH,V3,GRADE_11_12,HUMANITIES,CREATIVE_EXPRESSION,MCQ,ANALYZE,"Media literacy means being able to:","Consume all media content without questioning it","Critically analyze media messages — identifying bias source credibility framing techniques and the difference between news opinion and propaganda","Only trust government-approved media sources","Reject all media as unreliable and untrustworthy","N/A","B",4,75,"CORRECT=MEDIA_LITERACY+MEDIA","HARD",FALSE,"BOOST_MEDIA","Media literacy: ability to access analyze evaluate and create media. In the age of misinformation and deepfakes it is arguably the most important civic skill for democratic participation."
APG11HUM_CE_04,APTIPATH,V3,GRADE_11_12,HUMANITIES,CREATIVE_EXPRESSION,MCQ,EVALUATE,"A social media post about a political issue goes viral. Before forming your opinion the MOST intellectually rigorous approach is:","Accept the viral post as truth — popular content must be accurate","Seek primary sources verify claims through multiple credible outlets consider alternative perspectives and examine who benefits from this narrative before forming a position","Only read opinions from people who share your existing views","Ignore it — social media is never reliable","N/A","B",5,90,"CORRECT=CRITICAL_THINKING+MEDIA","HARD",FALSE,"BOOST_MEDIA+CIVIL_SERVICES","Information hygiene: primary source verification + multiple credible sources + perspective diversity + cui bono analysis (who benefits?). This is the intellectual discipline required for UPSC law and journalism."